Brand,Nama,Harga,Diskon,Harga Sebelum Diskon
None,FITS Sepatu Pro Springblade Series Sneakers Olahraga Casual Fitness Running Sekolah Shoes,25000000000,N/A,0
Tidak Ada Merek,Sepatu sneakers olahraga,7600000000,20%,9500000000
Tidak Ada Merek,Sepatu Converse Chuck Taylor 70s Low Pendek Hijau Army Glossy mengkilap PREMIUM,23000000000,N/A,0
Tidak Ada Merek,HIPZO M47 Sepatu Pria Waterproof Hiking Touring Sepatu Boots Pria,100000000,N/A,0
Tidak Ada Merek,Sepatu Converse 70S AllStar Chuck Taylor Underfeated Premium,24000000000,N/A,0
Tidak Ada Merek,Globalmarket.id Sepatu Sneakers Fashion Wanita Korea Import [TANPA DUS] - SHG031,7999900000,89%,69999900000
,VENTELA BASIC LOW 4 WARNA READY - SEPATU SNEAKER LOKAL TERBAIK,14424800000,20%,14424800000
Tidak Ada Merek,Big Sale 6.6 Sepatu Pria Murah Berkualitas Sport Sneakers Running Fashion (SUP 60),1500000000,25%,2000000000
Tidak Ada Merek,Sepatu Converse 70s Cream Low Pendek Glossy Mengkilap Premium,23000000000,N/A,0
Nike,Sepatu nike air force one model terbaru grade vietnam promo TERLARIS,16500000000,N/A,0
Tidak Ada Merek,HIPZO M39 Sepatu Pria Terbaru Sepatu Cowok Casual Kerja Sepatu,100000000,N/A,0
,Sepatu Pria | Sneakers Pria | Sepatu Olahraga Pria Original Murah Keren - Tih,30000000000,N/A,0
Tidak Ada Merek,5.5 BIG RAMADHAN Sepatu Wanita  terlaris BEIER / Sneakers,2400000000,31%,3500000000
Tidak Ada Merek,Importir.Fashion Sepatu Sneakers Korea Wanita Fashion Import Tanpa Kotak - SHG013,9499900000,65%,27000000000
PVN,PVN Aelin Sepatu Sneakers Putih Sepatu Casual Wanita Shoes 785,15990000000,68%,49990000000
Tidak Ada Merek,Avgoo Sepatu Pria Wanita Import Sepatu Casual (SPP20),33532000000,N/A,0
,Sepatu Sneakers Pria Wanita Sepatu Olahraga Sporty Running Jogging - Fashion  SEPATU PRIA,1012000000,56%,2300000000
,Sepatu sneakers olahraga alphabounce pria wanita termurah terlaris,5760000000,52%,12000000000
Tidak Ada Merek,Avgoo Sepatu Model Korea Import Lifestyle Sepatu runnig (DGH20),21340000000,50%,42680000000
Tidak Ada Merek,HIPZO M33 Sepatu Pria Sepatu Badminton Pria Sepatu Sport Pria,100000000,N/A,0
Tidak Ada Merek,SEPATU CONVERSE LOW 70S MINUSONE BLACK WHITE PREMIUM BNIB QUALITY IMPORT MADE IN VIETNAM BISA COD,24000000000,N/A,0
hipzo,100 % Original Sepatu Pria Hipzo M 032 Pria boots Original Kasual Casual Boots kulit hiking Gunung,9700000000,63%,26000000000
Tidak Ada Merek,HIPZO M34 Sepatu Pria Sepatu Safety Pria Sepatu Boots,100000000,N/A,0
,BORNEO BLT09 XAVYERA SEPATU PITA FLAT FLATSHOES BAHAM KANVAS PITA,4500000000,44%,8000000000
Dr. Kevin,Dr. Kevin Sepatu Sport Pria Men Sneakers 889-013 - (2 Color Options) Hitam Putih,11690000000,81%,59990000000
Nike,Sepatu Snekaers Nike Air Force 1 '07 White All Putih,80000000000,33%,119000000000
Tidak Ada Merek,Sepatu Converse 70s Hi Cream Chuck Taylor All Star Canvas High TopTinggi,23500000000,N/A,0
Ventela,Sepatu Sneaker By Ventela BTS 70s Low Glossy,22040200000,2%,22490000000
Tidak Ada Merek,HIPZO M45 Sepatu Pria Safety Sepatu Boots Pria Sepatu Riding,100000000,N/A,0
Tidak Ada Merek,[PROMO] Highland Sepatu Slip on Pria  Santai Casual Formal Suede Kerja Kantor Kuliah IMPORT MR214,9900000000,50%,19900000000
Tidak Ada Merek,Sepatu Sneaker Wanita Import - Sneaker Fair Wind Luxury DUK-321 Runn - Sepatu Olaharaga Cewe Santai,12540000000,60%,31000000000
Porto,Porto - Sepatu Wanita Flatshoes Balet Kain Nyaman Empuk Simple Pita Korea Casual Original BA202L,3267000000,67%,9900000000
,Sepatu Pantofel Pria Kickers Steven Kerja Cowo Formal Dinas Slop Casual Murah Limited Edition,5150000000,43%,9000000000
Tidak Ada Merek,LUXUS Dailu Sepatu Sneakers Import Fashion Wanita Korea - Free Gantungan Sepatu Trending Model,11999900000,14%,13999900000
Tidak Ada Merek,HIPZO M48 Sepatu Badminton Pria Wanita Sepatu Sport,100000000,N/A,0
Tidak Ada Merek,PHM Shoes [COD] PHM101 Sneakers Import Sepatu Olahraga Pria Kasual Running Sport Korea Import,8880000000,47%,16900000000
Tidak Ada Merek,Sepatu Converse Kulit PVC (Semi Kulit) Berkualitas Tinggi High Sepatu Pria Casual Trendy Kekinia,24500000000,N/A,0
Tidak Ada Merek,WAADOO FREE KAOS KAKI Sepatu Sneakers Covs Thanos Hijau,10900000000,64%,30000000000
Tidak Ada Merek,PVN Tiger Sepatu Pria Sneakers Import Sepatu Olahraga Kasual Shoes 449,9990000000,75%,39990000000
North Star,North Star Sepatu Sneakers Rover Black 5896032,12188800000,64%,33400000000
Tidak Ada Merek,Sepatu Boot AP Terra Eco 3 - Eco 3 Hijau Karet Tinggi Panjang Anti Slip Hijau - AP TERRA ECO 3 HIJAU,7380000000,N/A,0
Tidak Ada Merek,Sepatu Kets Kats Ket Sneakers Snikers Tanpa Tutup Belakang Wanita Cewek Murah Kekinian,4500000000,13%,4500000000
Blow,Blow BLAS 0007 Orla Sepatu Sneakers Sport Wanita,15900000000,75%,64700000000
Tidak Ada Merek,HIPZO M30 Sepatu Pria Kulit Sepatu Kerja Pria Sepatu Pria Fashion,100000000,N/A,0
Tidak Ada Merek,Avgoo Sepatu Olahraga Running Pria Import Sepatu Casual (NKH20),30264000000,N/A,0
,SEPATU PRIA HIKING NIKE AIR VEGASUS TERBARU,10500000000,N/A,0
Porto,Porto - Sepatu Flat Shoes Formal Kerja Kantor Casual Wanita Terbaru Nyaman Berkualitas Original BTC,3487500000,67%,10500000000
Tidak Ada Merek,Syra.footwear Sepatu Sneakers Import Wanita Korea Fashion ORIGINAL [TANPA KOTAK] - SHG005,8299900000,88%,69999900000
Porto,Porto - Sepatu Wanita Flatshoes Balet Kain Nyaman Empuk  Original BA201L,3300000000,67%,9900000000
,2.2 bayar ditempat sepatu converse alstar cowok cewek,5500000000,45%,10000000000
